{
  "schemaVersion": 1,
  "tool": {
    "name": "testguard",
    "version": "0.1.0"
  },
  "generatedAt": "2026-09-17T02:00:00Z",
  "head": "deadbeefcafe",
  "heading": "## TEST BLINDSPOT CONTEXT",
  "summary": {
    "claims": 2,
    "byVerdict": {
      "killed": 1,
      "survived": 1,
      "unverifiable": 1,
      "nocover": 1,
      "flaky-defender": 1
    },
    "new": 1,
    "baselined": 1
  },
  "items": [
    {
      "fingerprint": "01876384493be6809da455cb1a1c4bc92e7564e9898506d790b9589200502163",
      "claimId": "REDACT-001",
      "subjectId": "F1",
      "statement": "The audit record written for a redacted message never contains the original secret.",
      "verdict": "survived",
      "severity": "critical",
      "file": "src/redact.mjs",
      "rank": 9.5,
      "hint": "test/redact.test.mjs asserts with objectContaining and omits the `content` key.",
      "isNew": false
    },
    {
      "fingerprint": "0a0767ff8b124883e0bc042094c8494027b3d6d45bb8f4e40eda0930214a8970",
      "claimId": "REDACT-002",
      "subjectId": "F1",
      "statement": "A rule with an invalid pattern is skipped; it never aborts the scan.",
      "verdict": "unverifiable",
      "severity": "high",
      "file": "src/redact.mjs",
      "hint": "Anchor \"} catch { return null; }\" not found; re-author the fault.",
      "isNew": true
    }
  ],
  "text": "## TEST BLINDSPOT CONTEXT\n\nSource: testguard 0.1.0 @ deadbeefcafe. 2 claims; 1 killed, 1 survived, 1 unverifiable, 1 nocover, 1 flaky-defender. 1 new since baseline.\n\n1. [NEW] REDACT-002 unverifiable (high) src/redact.mjs — Anchor not found; re-author the fault.\n2. REDACT-001 SURVIVED (critical) src/redact.mjs — test/redact.test.mjs asserts with objectContaining and omits the `content` key.\n"
}
